journal	paper	author	url	size_in_kb	year	ju_url	cahc_authored
IJHS-24-1989-Issue-4	Madras Meridian Circle Observations of Fixed Stars during 1862–1887 	 S N Sen	https://insa.nic.in/(S(eh1ucortlbqqezipwgliy3mn))/writereaddata/UpLoadedFiles/IJHS/Vol24_4_4_SNSen.pdf	466.0			False
IJHS-24-1989-Issue-4	A Survey of Research and Development in Electronics and Telecommunication in India Over a Century (1850–1950) 	 Late M C Mallick	https://insa.nic.in/(S(eh1ucortlbqqezipwgliy3mn))/writereaddata/UpLoadedFiles/IJHS/Vol24_4_5_MCMallik.pdf	712.0			False
IJHS-24-1989-Issue-4	Chemical Research in India During Nineteenth Century 	 Aparajito Basu	https://insa.nic.in/(S(eh1ucortlbqqezipwgliy3mn))/writereaddata/UpLoadedFiles/IJHS/Vol24_4_6_ABasu.pdf	183.0			False
IJHS-24-1989-Issue-4	Weighing Devices in Ancient India 	 Vijaya Lakshmi Sharma and H C Bhardwaj	https://insa.nic.in/(S(eh1ucortlbqqezipwgliy3mn))/writereaddata/UpLoadedFiles/IJHS/Vol24_4_7_VLSharma.pdf	129.0			False
IJHS-24-1989-Issue-4	The Five Souls of Indian Medicine 	 S Mahdihassan	https://insa.nic.in/(S(eh1ucortlbqqezipwgliy3mn))/writereaddata/UpLoadedFiles/IJHS/Vol24_4_8_SMahadihassan.pdf	63.0			False
IJHS-24-1989-Issue-4	Book Review 	 C K Majumdar	https://insa.nic.in/(S(eh1ucortlbqqezipwgliy3mn))/writereaddata/UpLoadedFiles/IJHS/Vol24_4_9_BookReview.pdf	47.0			False
IJHS-24-1989-Issue-4	Report: Seminar on Astronomy and Mathematics in Ancient and Medieval India 	 S N Sen	https://insa.nic.in/(S(eh1ucortlbqqezipwgliy3mn))/writereaddata/UpLoadedFiles/IJHS/Vol24_4_10_Report.pdf	109.0			False
IJHS-24-1989-Issue-4	Supplement: Rasa Ratna Sammuccaya 	 	https://insa.nic.in/(S(eh1ucortlbqqezipwgliy3mn))/writereaddata/UpLoadedFiles/IJHS/Vol24_4_11_Supplement.pdf	427.0			False
IJHS-25-1990-Issue-1to4	The Phases of Magic Square of Three 	 S Mahdihassan	https://insa.nic.in/(S(eh1ucortlbqqezipwgliy3mn))/writereaddata/UpLoadedFiles/IJHS/Vol25_1to4_1_SMahdihassan.pdf	52.0			False
IJHS-25-1990-Issue-1to4	Ritual Geometry in India and its Parallelism in Other Cultures 	 A K Bag	https://insa.nic.in/(S(eh1ucortlbqqezipwgliy3mn))/writereaddata/UpLoadedFiles/IJHS/Vol25_1to4_2_AKBag.pdf	223.0			False
IJHS-25-1990-Issue-1to4	Ali Ibn Rabban At Tabari‚ A Ninth Century Arab Physician, on the Ayurveda 	 M S Khan	https://insa.nic.in/(S(eh1ucortlbqqezipwgliy3mn))/writereaddata/UpLoadedFiles/IJHS/Vol25_1to4_3_MSKhan.pdf	208.0			False
IJHS-25-1990-Issue-1to4	Zij–I–Muhammad and the Tables of De La Hire 	 Virendra Nath Sharma	https://insa.nic.in/(S(eh1ucortlbqqezipwgliy3mn))/writereaddata/UpLoadedFiles/IJHS/Vol25_1to4_4_VNSharma.pdf	192.0			False
IJHS-25-1990-Issue-1to4	News 	 	https://insa.nic.in/(S(eh1ucortlbqqezipwgliy3mn))/writereaddata/UpLoadedFiles/IJHS/Vol25_1to4_5_NewsProjectsapprovedNewpublication.pdf	109.0			False
IJHS-25-1990-Issue-1to4	Supplement—Laghumanasa of Manjula 	 	https://insa.nic.in/(S(eh1ucortlbqqezipwgliy3mn))/writereaddata/UpLoadedFiles/IJHS/Vol25_1to4_6_SupplementLaghumanasa.pdf	2361.0			False
IJHS-26-1991-Issue-1	Misidentification of some Indian Naksatras 	 K D Abhyankar	https://insa.nic.in/(S(eh1ucortlbqqezipwgliy3mn))/writereaddata/UpLoadedFiles/IJHS/Vol26_1_1_KDAbhyankar.pdf	160.0			False
IJHS-26-1991-Issue-1	The Vedic Gods Agni‚ Indra and Soma as Interrelated: A Study of Soma 	 S Mahadihassan	https://insa.nic.in/(S(eh1ucortlbqqezipwgliy3mn))/writereaddata/UpLoadedFiles/IJHS/Vol26_1_2_SMahdihassan.pdf	81.0			False
IJHS-26-1991-Issue-1	The Pratyayas: Indian Contribution to Combinatorics 	 L Alsdorf	https://insa.nic.in/(S(eh1ucortlbqqezipwgliy3mn))/writereaddata/UpLoadedFiles/IJHS/Vol26_1_3_SRSarma.pdf	630.0			False
IJHS-26-1991-Issue-1	Astronomy in Ancient India— Its Importance‚ Insight and Prevelance 	 S A Paramhans	https://insa.nic.in/(S(eh1ucortlbqqezipwgliy3mn))/writereaddata/UpLoadedFiles/IJHS/Vol26_1_4_SAParamhans.pdf	118.0			False
IJHS-26-1991-Issue-1	Some Studies on Varahamihira 	 A K Chakravaty	https://insa.nic.in/(S(eh1ucortlbqqezipwgliy3mn))/writereaddata/UpLoadedFiles/IJHS/Vol26_1_5_AKChakraborty.pdf	107.0			False
IJHS-26-1991-Issue-1	Level of Agricultural Technology in India (1757–1857) 	 S Sangwan	https://insa.nic.in/(S(eh1ucortlbqqezipwgliy3mn))/writereaddata/UpLoadedFiles/IJHS/Vol26_1_6_SSangwan.pdf	674.0			False
IJHS-26-1991-Issue-1	Radha Gobinda Chandra— A Pioneer in Astronomical Observations in India 	 A Bandyopadhyay	https://insa.nic.in/(S(eh1ucortlbqqezipwgliy3mn))/writereaddata/UpLoadedFiles/IJHS/Vol26_1_7_ABandyopandhyay.pdf	175.0			False
IJHS-26-1991-Issue-1	Book Review: Vatesvara Siddhanta and Gola of Vatesvara by K S Shukla 	 D Pingree	https://insa.nic.in/(S(eh1ucortlbqqezipwgliy3mn))/writereaddata/UpLoadedFiles/IJHS/Vol26_1_8_BookReview.pdf	111.0			False
IJHS-26-1991-Issue-2	Alcoholic Fermentation and its Products in Ancient India 	 K T Achaya	https://insa.nic.in/(S(eh1ucortlbqqezipwgliy3mn))/writereaddata/UpLoadedFiles/IJHS/Vol26_2_1_KTAcharya.pdf	104.0			False
IJHS-26-1991-Issue-2	The Word Kohala in Susruta and Term Alcool–Vini of Paracelsus 	 S Mahadihassan	https://insa.nic.in/(S(eh1ucortlbqqezipwgliy3mn))/writereaddata/UpLoadedFiles/IJHS/Vol26_2_2_SMahdihassan.pdf	34.0			False
IJHS-26-1991-Issue-2	Minerals and Gems in Indian Alchemy 	 Mira Ray	https://insa.nic.in/(S(eh1ucortlbqqezipwgliy3mn))/writereaddata/UpLoadedFiles/IJHS/Vol26_2_3_MRay.pdf	313.0			False
IJHS-26-1991-Issue-2	Arbori–Horticulture: As Known in the Puranas 	 M Chaudhuri	https://insa.nic.in/(S(eh1ucortlbqqezipwgliy3mn))/writereaddata/UpLoadedFiles/IJHS/Vol26_2_4_MChaudhuri.pdf	65.0			False
IJHS-26-1991-Issue-2	Dyeing Agents in India A D 1200–1800 	 H K Naqvi	https://insa.nic.in/(S(eh1ucortlbqqezipwgliy3mn))/writereaddata/UpLoadedFiles/IJHS/Vol26_2_5_HKNaqvi.pdf	272.0			False
IJHS-26-1991-Issue-2	Yuktibhasa of Jyesthadeva 	 K V Sarma and S Hariharan	https://insa.nic.in/(S(eh1ucortlbqqezipwgliy3mn))/writereaddata/UpLoadedFiles/IJHS/Vol26_2_6_KVSarma.pdf	316.0			False
IJHS-26-1991-Issue-2	The Kapala Yantras of Sawai Jai Singh 	 V N Sharma	https://insa.nic.in/(S(eh1ucortlbqqezipwgliy3mn))/writereaddata/UpLoadedFiles/IJHS/Vol26_2_7_VNSharma.pdf	135.0			False
IJHS-26-1991-Issue-2	Optical Glass: Its Manufacture in India— A Historical Perspective 	 A K Saxena‚ A Vagiswari and M Manjula	https://insa.nic.in/(S(eh1ucortlbqqezipwgliy3mn))/writereaddata/UpLoadedFiles/IJHS/Vol26_2_8_AKSaxena.pdf	176.0			False
IJHS-26-1991-Issue-2	News: Seminar on Indian Astronomy and Jai Singh— A Report 	 S M R Ansari	https://insa.nic.in/(S(eh1ucortlbqqezipwgliy3mn))/writereaddata/UpLoadedFiles/IJHS/Vol26_2_9_NewsIHCongress.pdf	27.0			False
IJHS-26-1991-Issue-3	An Anonymous Treatise on Pathyapathya 	 P V Sharma	https://insa.nic.in/(S(eh1ucortlbqqezipwgliy3mn))/writereaddata/UpLoadedFiles/IJHS/Vol26_3_1_PVSharma.pdf	229.0			False
IJHS-26-1991-Issue-3	Precision Instruments of Sawai Jai Singh 	 V N Sharma	https://insa.nic.in/(S(eh1ucortlbqqezipwgliy3mn))/writereaddata/UpLoadedFiles/IJHS/Vol26_3_2_VNSharma.pdf	508.0			False
IJHS-26-1991-Issue-3	Europe–India Telegraph “Bridge” via the Caucasus 	 A Karbelashvili	https://insa.nic.in/(S(eh1ucortlbqqezipwgliy3mn))/writereaddata/UpLoadedFiles/IJHS/Vol26_3_3_AKarbelashvili.pdf	90.0			False
IJHS-26-1991-Issue-3	Newton’s Physics in the Context of His Works on Chemistry and Alchemy 	 P K Basu	https://insa.nic.in/(S(eh1ucortlbqqezipwgliy3mn))/writereaddata/UpLoadedFiles/IJHS/Vol26_3_4_PKBasu.pdf	492.0			False
IJHS-26-1991-Issue-3	Supplement: Rasa Ratna Samuccaya (Part II) 	 	https://insa.nic.in/(S(eh1ucortlbqqezipwgliy3mn))/writereaddata/UpLoadedFiles/IJHS/Vol26_3_5_SupplementRasaratnasamucchaya.pdf	386.0			False
IJHS-26-1991-Issue-4	Metallurgy of Iron and Steel Making and Blacksmithy in Ancient India 	 B Prakash	https://insa.nic.in/(S(eh1ucortlbqqezipwgliy3mn))/writereaddata/UpLoadedFiles/IJHS/Vol26_4_1_BPrakash.pdf	449.0			False
IJHS-26-1991-Issue-4	A Consolidated Symbol of Cosmology 	 S Mahadihassan	https://insa.nic.in/(S(eh1ucortlbqqezipwgliy3mn))/writereaddata/UpLoadedFiles/IJHS/Vol26_4_2_SMahdihassan.pdf	37.0			False
IJHS-26-1991-Issue-4	A Comparative Study on Cometary Records from the Brhat Samhita and Bhadrabahu Samhita 	 N K Chandel and S Sharma	https://insa.nic.in/(S(eh1ucortlbqqezipwgliy3mn))/writereaddata/UpLoadedFiles/IJHS/Vol26_4_3_NKChandel.pdf	111.0			False
IJHS-26-1991-Issue-4	Mean Sun and Moon in Ancient Greek and Indian Astronomy 	 George Abraham	https://insa.nic.in/(S(eh1ucortlbqqezipwgliy3mn))/writereaddata/UpLoadedFiles/IJHS/Vol26_4_4_GAbraham.pdf	64.0			False
IJHS-26-1991-Issue-4	Realism in Science 	 S P Gupta	https://insa.nic.in/(S(eh1ucortlbqqezipwgliy3mn))/writereaddata/UpLoadedFiles/IJHS/Vol26_4_5_SPGupta.pdf	59.0			False
IJHS-26-1991-Issue-4	Supplements 	 	https://insa.nic.in/(S(eh1ucortlbqqezipwgliy3mn))/writereaddata/UpLoadedFiles/IJHS/Vol26_4_6_SupplementsPanchavimsatika.pdf	1078.0			False
IJHS-27-1992-Issue-1	The Five Elements of Chinese Cosmology in the Light of Dialectism 	 S Mahdihassan	https://insa.nic.in/(S(eh1ucortlbqqezipwgliy3mn))/writereaddata/UpLoadedFiles/IJHS/Vol27_1_1_SMahdihassan.pdf	41.0			False
IJHS-27-1992-Issue-1	Indian Oilpress (Ghani) 	 K T Acharya	https://insa.nic.in/(S(eh1ucortlbqqezipwgliy3mn))/writereaddata/UpLoadedFiles/IJHS/Vol27_1_2_KTAchaya.pdf	131.0			False
IJHS-27-1992-Issue-1	Yogaratnakara— An Important Source Book in Medicine 	 Nirmal Saxena	https://insa.nic.in/(S(eh1ucortlbqqezipwgliy3mn))/writereaddata/UpLoadedFiles/IJHS/Vol27_1_3_NSaxena.pdf	188.0			False
IJHS-27-1992-Issue-1	Krsi– Parasara 	 Kafil Ahmed Chowdhury	https://insa.nic.in/(S(eh1ucortlbqqezipwgliy3mn))/writereaddata/UpLoadedFiles/IJHS/Vol27_1_4_KAChowdhury.pdf	337.0			False
IJHS-27-1992-Issue-1	Magic Squares in India 	 Bibhutibhusan Datta and Awadhesh Narayan Singh	https://insa.nic.in/(S(eh1ucortlbqqezipwgliy3mn))/writereaddata/UpLoadedFiles/IJHS/Vol27_1_5_BDatta.pdf	1067.0			False
IJHS-27-1992-Issue-2	Vangastambhanasodhanam: A Chapter on Metallurgy of Tin in Sanskrit Alchemical Text ‘Rasopanisad’ 	 Vijaya Deshpande	https://insa.nic.in/(S(eh1ucortlbqqezipwgliy3mn))/writereaddata/UpLoadedFiles/IJHS/Vol27_2_1_VDeshpande.pdf	158.0			False
IJHS-27-1992-Issue-2	Horseshoeing in Mughal India 	 A Jan Qaisar	https://insa.nic.in/(S(eh1ucortlbqqezipwgliy3mn))/writereaddata/UpLoadedFiles/IJHS/Vol27_2_2_AJQaisar.pdf	220.0			False
IJHS-27-1992-Issue-2	Science versus Technology: The Early Years of Kala Bhawan, Baroda 1890–1896 	 Makrand Mehta	https://insa.nic.in/(S(eh1ucortlbqqezipwgliy3mn))/writereaddata/UpLoadedFiles/IJHS/Vol27_2_3_MMehta.pdf	351.0			False
IJHS-27-1992-Issue-2	Origin of India's National Science Policy: M L Sircar to M K Gandhi, 1875–1935 	 Jagdish N Sinha	https://insa.nic.in/(S(eh1ucortlbqqezipwgliy3mn))/writereaddata/UpLoadedFiles/IJHS/Vol27_2_4_JNSinha.pdf	201.0			False
IJHS-27-1992-Issue-2	Book Review 	 Deepak Kumar	https://insa.nic.in/(S(eh1ucortlbqqezipwgliy3mn))/writereaddata/UpLoadedFiles/IJHS/Vol27_2_5_BookReviews.pdf	40.0			False
IJHS-27-1992-Issue-2	New Publications 	 	https://insa.nic.in/(S(eh1ucortlbqqezipwgliy3mn))/writereaddata/UpLoadedFiles/IJHS/Vol27_2_6_NewPublications.pdf	21.0			False
IJHS-27-1992-Issue-3	Fabric of Life: Paryapati Pranapana in Jaina Agama 	 J C Sikdar	https://insa.nic.in/(S(eh1ucortlbqqezipwgliy3mn))/writereaddata/UpLoadedFiles/IJHS/Vol27_3_1_JCSikdar.pdf	107.0			False
IJHS-27-1992-Issue-3	Use of Permutations and Combinations in India 	 Bibhutibhusan Datta and Awadhesh Narayan Singh	https://insa.nic.in/(S(eh1ucortlbqqezipwgliy3mn))/writereaddata/UpLoadedFiles/IJHS/Vol27_3_2_BDatta.pdf	217.0			False
IJHS-27-1992-Issue-3	Gemmology in Ancient India 	 Radha Krishnamurthy	https://insa.nic.in/(S(eh1ucortlbqqezipwgliy3mn))/writereaddata/UpLoadedFiles/IJHS/Vol27_3_3_RKrishnamurthy.pdf	134.0			False
IJHS-27-1992-Issue-3	Study of Muslim Alchemy in the Medieval Ages & some Valuable Chemicals Transmitted to Modern Chemistry 	 Aftab Saeed	https://insa.nic.in/(S(eh1ucortlbqqezipwgliy3mn))/writereaddata/UpLoadedFiles/IJHS/Vol27_3_4_ASaeed.pdf	233.0			False
IJHS-27-1992-Issue-3	Role of Ram Bramha Sanyal in Initiating Zoological Researches on the Animals in Captivity 	 D K Mittra	https://insa.nic.in/(S(eh1ucortlbqqezipwgliy3mn))/writereaddata/UpLoadedFiles/IJHS/Vol27_3_5_DKMittra.pdf	170.0			False
IJHS-27-1992-Issue-3	The First Indian Aeronaut 	 Amitabha Ghosh	https://insa.nic.in/(S(eh1ucortlbqqezipwgliy3mn))/writereaddata/UpLoadedFiles/IJHS/Vol27_3_6_AGhosh.pdf	319.0			False
IJHS-27-1992-Issue-3	News 	 	https://insa.nic.in/(S(eh1ucortlbqqezipwgliy3mn))/writereaddata/UpLoadedFiles/IJHS/Vol27_3_7_News.pdf	32.0			False
IJHS-27-1992-Issue-3	Supplement: Rasa Ratna Samuccaya 	 D Joshi	https://insa.nic.in/(S(eh1ucortlbqqezipwgliy3mn))/writereaddata/UpLoadedFiles/IJHS/Vol27_3_8_Supplement_RasaRatnaSamuccaya.pdf	616.0			False
IJHS-27-1992-Issue-4	Factors in the Develoment of Scientific Research in India between 1906 and 1930 	 S N Sen	https://insa.nic.in/(S(eh1ucortlbqqezipwgliy3mn))/writereaddata/UpLoadedFiles/IJHS/Vol27_4_1_SNSen.pdf	144.0			False
IJHS-27-1992-Issue-4	Development of Mathematical Sciences in India during the Twentieth Century 	 J N Kapur	https://insa.nic.in/(S(eh1ucortlbqqezipwgliy3mn))/writereaddata/UpLoadedFiles/IJHS/Vol27_4_2_JNKapur.pdf	265.0			False
IJHS-27-1992-Issue-4	Luminescence and Allied Phenomena 	 H N Bose	https://insa.nic.in/(S(eh1ucortlbqqezipwgliy3mn))/writereaddata/UpLoadedFiles/IJHS/Vol27_4_3_HNBose.pdf	165.0			False
IJHS-27-1992-Issue-4	Solid State Physics: 1900–1980 	 C K Majumdar	https://insa.nic.in/(S(eh1ucortlbqqezipwgliy3mn))/writereaddata/UpLoadedFiles/IJHS/Vol27_4_4_CKMajumdar.pdf	241.0			False
IJHS-27-1992-Issue-4	Pattern of Research in India on Theoritical Astronomy and Astrophysics during period 1900–1980 	 A K Raychaudhuri	https://insa.nic.in/(S(eh1ucortlbqqezipwgliy3mn))/writereaddata/UpLoadedFiles/IJHS/Vol27_4_5_AKRaychaudhuri.pdf	87.0			False
IJHS-27-1992-Issue-4	Evolution of Continental Crust of India: Growth of Knowledge. 1900–1980 — A Review 	 A K Saha	https://insa.nic.in/(S(eh1ucortlbqqezipwgliy3mn))/writereaddata/UpLoadedFiles/IJHS/Vol27_4_6_AKSaha.pdf	48.0			False
IJHS-27-1992-Issue-4	Progress in Indian Agriculture: 1900–1980 	 S K Mukherjee	https://insa.nic.in/(S(eh1ucortlbqqezipwgliy3mn))/writereaddata/UpLoadedFiles/IJHS/Vol27_4_7_SKMukherjee.pdf	131.0			False
IJHS-27-1992-Issue-4	Development of Inorganic Chemistry in India during 1900–1980 	 R C Mehrotra	https://insa.nic.in/(S(eh1ucortlbqqezipwgliy3mn))/writereaddata/UpLoadedFiles/IJHS/Vol27_4_8_RCMehrotra.pdf	115.0			False
IJHS-27-1992-Issue-4	Mineral Exploration in the Twentieth Century 	 S K Mukerjee	https://insa.nic.in/(S(eh1ucortlbqqezipwgliy3mn))/writereaddata/UpLoadedFiles/IJHS/Vol27_4_9_SKMukerjee.pdf	274.0			False
IJHS-27-1992-Issue-4	Progress in Telecommunications and R & D during Post–war Years (1945–84) — A Review 	 J Das	https://insa.nic.in/(S(eh1ucortlbqqezipwgliy3mn))/writereaddata/UpLoadedFiles/IJHS/Vol27_4_10_JDas.pdf	122.0			False
IJHS-27-1992-Issue-4	Space Science in India 	 R R Daniel	https://insa.nic.in/(S(eh1ucortlbqqezipwgliy3mn))/writereaddata/UpLoadedFiles/IJHS/Vol27_4_11_RRDaniel.pdf	222.0			False
IJHS-27-1992-Issue-4	Book Review 	 	https://insa.nic.in/(S(eh1ucortlbqqezipwgliy3mn))/writereaddata/UpLoadedFiles/IJHS/Vol27_4_12_BookReviews.pdf	68.0			False
IJHS-27-1992-Issue-4	Orbituary: S N Sen 	 	https://insa.nic.in/(S(eh1ucortlbqqezipwgliy3mn))/writereaddata/UpLoadedFiles/IJHS/Vol27_4_13_Obituary_SNSen.pdf	56.0			False
IJHS-27-1992-Issue-4	Erratum 	 	https://insa.nic.in/(S(eh1ucortlbqqezipwgliy3mn))/writereaddata/UpLoadedFiles/IJHS/Vol27_4_16_Erratum.pdf	45.0			False
IJHS-27-1992-Issue-4	Supplement: Bibliography of Physics, Astronomy, Astrophysics and Geophysics in India 	 	https://insa.nic.in/(S(eh1ucortlbqqezipwgliy3mn))/writereaddata/UpLoadedFiles/IJHS/Vol27_4_17_SupplementBibliographyofPhysics.pdf	521.0			False
IJHS-28-1993-Issue-1	A Search for the Earliest Vedic Calender 	 K D Abhyankar	https://insa.nic.in/(S(eh1ucortlbqqezipwgliy3mn))/writereaddata/UpLoadedFiles/IJHS/Vol28_1_1_KDAbhyankar.pdf	209.0			False
IJHS-28-1993-Issue-1	Astronomy of the Satapatha Brahmana 	 Subhash C Kak	https://insa.nic.in/(S(eh1ucortlbqqezipwgliy3mn))/writereaddata/UpLoadedFiles/IJHS/Vol28_1_2_SCKak.pdf	297.0			False
IJHS-28-1993-Issue-1	A Fragment of the Lauhasastra of Nagarjuna 	 P V Sharma	https://insa.nic.in/(S(eh1ucortlbqqezipwgliy3mn))/writereaddata/UpLoadedFiles/IJHS/Vol28_1_3_PVSharma.pdf	253.0			False
IJHS-28-1993-Issue-1	Pratibimba Siddhanta of Jai Singh’s Library 	 V N Sharma	https://insa.nic.in/(S(eh1ucortlbqqezipwgliy3mn))/writereaddata/UpLoadedFiles/IJHS/Vol28_1_4_VNSharma.pdf	82.0			False
IJHS-28-1993-Issue-1	Two Mughal Celestial Globes 	 S R Sarma‚ S M R Ansari and A G Kulkarni	https://insa.nic.in/(S(eh1ucortlbqqezipwgliy3mn))/writereaddata/UpLoadedFiles/IJHS/Vol28_1_5_SRSarma.pdf	350.0			False
IJHS-28-1993-Issue-1	Birbal Sahni and India– Madagascar Fit 	 Sanjay Chandra	https://insa.nic.in/(S(eh1ucortlbqqezipwgliy3mn))/writereaddata/UpLoadedFiles/IJHS/Vol28_1_6_SChandra.pdf	54.0			False
IJHS-28-1993-Issue-1	Supplement 	 	https://insa.nic.in/(S(eh1ucortlbqqezipwgliy3mn))/writereaddata/UpLoadedFiles/IJHS/Vol28_1_7_SupplementBibliographyofPhysics.pdf	1873.0			False
IJHS-28-1993-Issue-2	The Structure of the Rgveda 	 Subhash C Kak	https://insa.nic.in/(S(eh1ucortlbqqezipwgliy3mn))/writereaddata/UpLoadedFiles/IJHS/Vol28_2_1_SCKak.pdf	141.0			False
IJHS-28-1993-Issue-2	Sundararaja’s Improvements of Vedic Circle–Square Conversions 	 R C Gupta	https://insa.nic.in/(S(eh1ucortlbqqezipwgliy3mn))/writereaddata/UpLoadedFiles/IJHS/Vol28_2_2_RCGupta.pdf	276.0			False
IJHS-28-1993-Issue-2	Use of Series in India 	 B Datta and A N Singh	https://insa.nic.in/(S(eh1ucortlbqqezipwgliy3mn))/writereaddata/UpLoadedFiles/IJHS/Vol28_2_3_BDatta.pdf	317.0			False
IJHS-28-1993-Issue-2	Sawai Jai Singh’s Hindu Astronomers 	 V N Sharma	https://insa.nic.in/(S(eh1ucortlbqqezipwgliy3mn))/writereaddata/UpLoadedFiles/IJHS/Vol28_2_4_VNSharma.pdf	456.0			False
IJHS-28-1993-Issue-2	Account by Joseph Dubois of Astronomical Work under Jai Singh Sawai 	 Raymond Mercier	https://insa.nic.in/(S(eh1ucortlbqqezipwgliy3mn))/writereaddata/UpLoadedFiles/IJHS/Vol28_2_5_RMercier.pdf	169.0			False
IJHS-28-1993-Issue-2	Golak Chandra: India’s Pioneer Innovator Technician 	 Amitabha Ghosh	https://insa.nic.in/(S(eh1ucortlbqqezipwgliy3mn))/writereaddata/UpLoadedFiles/IJHS/Vol28_2_6_AGhosh.pdf	405.0			False
IJHS-28-1993-Issue-2	Book Review: Glimpses of India’s Statistical Heritage by J K Ghosh‚ S K Mitra and K R Parthasarthy 	 J N Kapur	https://insa.nic.in/(S(eh1ucortlbqqezipwgliy3mn))/writereaddata/UpLoadedFiles/IJHS/Vol28_2_7_BookReview.pdf	70.0			False
IJHS-28-1993-Issue-2	Supplement 	 	https://insa.nic.in/(S(eh1ucortlbqqezipwgliy3mn))/writereaddata/UpLoadedFiles/IJHS/Vol28_2_8_SupplementBiblographyofPhysics.pdf	2214.0			False
IJHS-28-1993-Issue-3	Development of Astronomical Observation in Vedic and Post–Vedic India 	 Yukio Ohashi	https://insa.nic.in/(S(eh1ucortlbqqezipwgliy3mn))/writereaddata/UpLoadedFiles/IJHS/Vol28_3_1_YOhashi.pdf	1027.0			False
IJHS-28-1993-Issue-3	Surds in Hindu Mathematics 	 B Datta and A N Singh	https://insa.nic.in/(S(eh1ucortlbqqezipwgliy3mn))/writereaddata/UpLoadedFiles/IJHS/Vol28_3_2_BDatta.pdf	166.0			False
IJHS-28-1993-Issue-3	Approximate Values of Surds in Hindu Mathematics 	 B Datta and A N Singh	https://insa.nic.in/(S(eh1ucortlbqqezipwgliy3mn))/writereaddata/UpLoadedFiles/IJHS/Vol28_3_3_BDatta.pdf	111.0			False
IJHS-28-1993-Issue-3	Life and Works of Puran Singh 	 H S Virk	https://insa.nic.in/(S(eh1ucortlbqqezipwgliy3mn))/writereaddata/UpLoadedFiles/IJHS/Vol28_3_4_HSVirk.pdf	168.0			False
IJHS-28-1993-Issue-3	News 	 	https://insa.nic.in/(S(eh1ucortlbqqezipwgliy3mn))/writereaddata/UpLoadedFiles/IJHS/Vol28_3_5_News.pdf	42.0			False
IJHS-28-1993-Issue-4	Formalisation and Orality in Panini’s Astadhyayi 	 P S Filliozat	https://insa.nic.in/(S(eh1ucortlbqqezipwgliy3mn))/writereaddata/UpLoadedFiles/IJHS/Vol28_4_1_PSFilliozat.pdf	172.0			False
IJHS-28-1993-Issue-4	Constant–Set (Dhruva–Rasi) Technique in Jaina School of Astronomy 	 L C Jain and K P Jain	https://insa.nic.in/(S(eh1ucortlbqqezipwgliy3mn))/writereaddata/UpLoadedFiles/IJHS/Vol28_4_2_LCJain.pdf	103.0			False
IJHS-28-1993-Issue-4	The Primacy of India in Ancient Brass and Zinc Metallurgy 	 A K Biwas	https://insa.nic.in/(S(eh1ucortlbqqezipwgliy3mn))/writereaddata/UpLoadedFiles/IJHS/Vol28_4_3_AKBiswas.pdf	398.0			False
IJHS-28-1993-Issue-4	Book Reviews 	 	https://insa.nic.in/(S(eh1ucortlbqqezipwgliy3mn))/writereaddata/UpLoadedFiles/IJHS/Vol28_4_4_BookReviewsAKBiswasAndARahman.pdf	72.0			False
IJHS-28-1993-Issue-4	Supplement 	 	https://insa.nic.in/(S(eh1ucortlbqqezipwgliy3mn))/writereaddata/UpLoadedFiles/IJHS/Vol28_4_5_SupplementBibliographyofPhysics.pdf	2284.0			False
IJHS-29-1994-Issue-1	Calcutta: The Emergence of a Science City (1784–1856) 	 Deepak Kumar	https://insa.nic.in/(S(eh1ucortlbqqezipwgliy3mn))/writereaddata/UpLoadedFiles/IJHS/Vol29_1_1_DKumar.pdf	127.0			False
IJHS-29-1994-Issue-1	William O’Shaughnessy – An Innovator and Entrepreneur 	 Saroj Ghose	https://insa.nic.in/(S(eh1ucortlbqqezipwgliy3mn))/writereaddata/UpLoadedFiles/IJHS/Vol29_1_2_SGhose.pdf	226.0			False
IJHS-29-1994-Issue-1	John Henry Pratt‚ Archdeacon of Calcutta and His Theory of Isostatic Compensation 	 Manidipa Kahali	https://insa.nic.in/(S(eh1ucortlbqqezipwgliy3mn))/writereaddata/UpLoadedFiles/IJHS/Vol29_1_3_MKahali.pdf	123.0			False
IJHS-29-1994-Issue-1	Madhusudan Gupta 	 Debasis Bose	https://insa.nic.in/(S(eh1ucortlbqqezipwgliy3mn))/writereaddata/UpLoadedFiles/IJHS/Vol29_1_4_DBose.pdf	162.0			False
IJHS-29-1994-Issue-1	The Pioneering Role of Calcutta in Scientific and Technical Education in India 	 S N Sen	https://insa.nic.in/(S(eh1ucortlbqqezipwgliy3mn))/writereaddata/UpLoadedFiles/IJHS/Vol29_1_5_SNSen.pdf	117.0			False
IJHS-29-1994-Issue-1	Calcutta University and Science 	 S C Ghosh	https://insa.nic.in/(S(eh1ucortlbqqezipwgliy3mn))/writereaddata/UpLoadedFiles/IJHS/Vol29_1_6_SCGhosh.pdf	193.0			False
IJHS-29-1994-Issue-1	Some Eminent Indian Pioneers in the Field of Technology 	 Amitabha Ghosh	https://insa.nic.in/(S(eh1ucortlbqqezipwgliy3mn))/writereaddata/UpLoadedFiles/IJHS/Vol29_1_7_AGhosh.pdf	243.0			False
IJHS-29-1994-Issue-1	Reverend Father Eugene Lafont and the Scientific Activity of St Xaviers College 	 Arun Kumar Biswas	https://insa.nic.in/(S(eh1ucortlbqqezipwgliy3mn))/writereaddata/UpLoadedFiles/IJHS/Vol29_1_8_AKBiswas.pdf	204.0			False
IJHS-29-1994-Issue-1	Mahalanobis and the Art and Science of Statistics: The Early Days 	 J K Ghosh	https://insa.nic.in/(S(eh1ucortlbqqezipwgliy3mn))/writereaddata/UpLoadedFiles/IJHS/Vol29_1_9_JKGhosh.pdf	159.0			False
IJHS-29-1994-Issue-1	Meghnad Saha – The Scientist and the Institution Builder 	 Santimay Chatterjee	https://insa.nic.in/(S(eh1ucortlbqqezipwgliy3mn))/writereaddata/UpLoadedFiles/IJHS/Vol29_1_10_SChatterjee.pdf	180.0			False
IJHS-29-1994-Issue-1	Four Calcuttans in Defence of Scientific Temper 	 Debiprasad Chattopadhyay	https://insa.nic.in/(S(eh1ucortlbqqezipwgliy3mn))/writereaddata/UpLoadedFiles/IJHS/Vol29_1_11_DChattopadhyaya.pdf	128.0			False
IJHS-29-1994-Issue-1	News 	 	https://insa.nic.in/(S(eh1ucortlbqqezipwgliy3mn))/writereaddata/UpLoadedFiles/IJHS/Vol29_1_12_News.pdf	66.0			False
IJHS-29-1994-Issue-1	Supplement: On the Desirability of a National Institution for the Cultivation of the Sciences by the Natives of India (1872–1876) 	 Mahendralal Sircar	https://insa.nic.in/(S(eh1ucortlbqqezipwgliy3mn))/writereaddata/UpLoadedFiles/IJHS/Vol29_1_13_Supplement.pdf	633.0			False
IJHS-29-1994-Issue-2	Vaidurya‚ Marakata and Other Beryl Family Gem Minerals: Etymology and Traditions in Ancient India 	 Arun Kumar Biswas	https://insa.nic.in/(S(eh1ucortlbqqezipwgliy3mn))/writereaddata/UpLoadedFiles/IJHS/Vol29_2_2_AKBiswas.pdf	700.0			False
IJHS-29-1994-Issue-2	Astronomical Instruments in Classical Siddhantas 	 Yukio Ohashi	https://insa.nic.in/(S(eh1ucortlbqqezipwgliy3mn))/writereaddata/UpLoadedFiles/IJHS/Vol29_2_3_YOhashi.pdf	2055.0			False
IJHS-29-1994-Issue-2	Sulbarakalikacchedah: Medieval Methods for Cleansing Metal Surfaces and Removing Tarnishes 	 Vijaya Deshpande	https://insa.nic.in/(S(eh1ucortlbqqezipwgliy3mn))/writereaddata/UpLoadedFiles/IJHS/Vol29_2_4_VDeshpande.pdf	180.0			False
IJHS-29-1994-Issue-2	D’Apres De Mannevillette Captain and Hydrographer to the French East India Company (1707–1780) 	 Manonmani Filliozat	https://insa.nic.in/(S(eh1ucortlbqqezipwgliy3mn))/writereaddata/UpLoadedFiles/IJHS/Vol29_2_5_MFilliozat.pdf	218.0			False
IJHS-29-1994-Issue-2	News 	 	https://insa.nic.in/(S(eh1ucortlbqqezipwgliy3mn))/writereaddata/UpLoadedFiles/IJHS/Vol29_2_6_News.pdf	118.0			False
IJHS-29-1994-Issue-3	Carburisation of Iron in Ancient India 	 S K Bhatia	https://insa.nic.in/(S(eh1ucortlbqqezipwgliy3mn))/writereaddata/UpLoadedFiles/IJHS/Vol29_3_1_SKBhatia.pdf	135.0			False
IJHS-29-1994-Issue-3	Metrology and Coinage in Ancient India and Contemporary World 	 N G Dongre	https://insa.nic.in/(S(eh1ucortlbqqezipwgliy3mn))/writereaddata/UpLoadedFiles/IJHS/Vol29_3_2_NGDongre.pdf	161.0			False
IJHS-29-1994-Issue-3	Evolution of Early Writing in India 	 Subhash C Kak	https://insa.nic.in/(S(eh1ucortlbqqezipwgliy3mn))/writereaddata/UpLoadedFiles/IJHS/Vol29_3_3_SCKak.pdf	219.0			False
IJHS-29-1994-Issue-3	Gem—Minerals in Pre–Modern India 	 Arun Kumar Biswas	https://insa.nic.in/(S(eh1ucortlbqqezipwgliy3mn))/writereaddata/UpLoadedFiles/IJHS/Vol29_3_4_AKBiswas.pdf	498.0			False
IJHS-29-1994-Issue-3	Metallurgy and Traditional Metal Crafts in Tamil Nadu 	 Vijaya Ramaswamy	https://insa.nic.in/(S(eh1ucortlbqqezipwgliy3mn))/writereaddata/UpLoadedFiles/IJHS/Vol29_3_5_VRamaswamy.pdf	193.0			False
