journal	paper	author	url	size_in_kb	year	ju_url	cahc_authored
IJHS-52-2017-Issue-1	Project Report: History of Neurodegenerative Diseases and its impact on Aged Population in India: An Assessment 	 Saumitra Basu	https://insa.nic.in/(S(eh1ucortlbqqezipwgliy3mn))/writereaddata/UpLoadedFiles/IJHS/Vol52_1_2017_Art11.pdf	378.0			False
IJHS-52-2017-Issue-2	Contents 	 Contents	https://insa.nic.in/(S(eh1ucortlbqqezipwgliy3mn))/writereaddata/UpLoadedFiles/IJHS/Vol52_2_2017__Contents.pdf	163.0			False
IJHS-52-2017-Issue-2	Angular Diameters (bimba) of the Sun, Moon and Earth’s Shadow-cone in Indian Astronomy: A Comparative Study 	 S Balachandra Rao, M Shailaja and V Vanaja	https://insa.nic.in/(S(eh1ucortlbqqezipwgliy3mn))/writereaddata/UpLoadedFiles/IJHS/Vol52_2_2017__Art01.pdf	579.0			False
IJHS-52-2017-Issue-2	Novel Proofs for Summations in the Nisrstarthaduti 	 Aditya Kolachana, K Mahesh and K Ramasubramanian	https://insa.nic.in/(S(eh1ucortlbqqezipwgliy3mn))/writereaddata/UpLoadedFiles/IJHS/Vol52_2_2017__Art02.pdf	293.0			False
IJHS-52-2017-Issue-2	Sundial for Time–keeping in Jaisalmer Fort 	 Aalok Pandya, Tej Bahadur and Sandip Bhattachar	https://insa.nic.in/(S(eh1ucortlbqqezipwgliy3mn))/writereaddata/UpLoadedFiles/IJHS/Vol52_2_2017__Art03.pdf	636.0			False
IJHS-52-2017-Issue-2	Edward Blyth and the Asiatic Society 	 Aparajita Basu	https://insa.nic.in/(S(eh1ucortlbqqezipwgliy3mn))/writereaddata/UpLoadedFiles/IJHS/Vol52_2_2017__Art04.pdf	343.0			False
IJHS-52-2017-Issue-2	Central Weaving Institute, Banaras: A Cultural Encounter between the Native and the Modern Form of Instructional Practices 	 Prakrati Bhargava	https://insa.nic.in/(S(eh1ucortlbqqezipwgliy3mn))/writereaddata/UpLoadedFiles/IJHS/Vol52_2_2017__Art05.pdf	368.0			False
IJHS-52-2017-Issue-2	The History of Colonial Science and Medicine in British India: Centre-Periphery Perspective 	 Rahul Bhaumik	https://insa.nic.in/(S(eh1ucortlbqqezipwgliy3mn))/writereaddata/UpLoadedFiles/IJHS/Vol52_2_2017__Art06.pdf	326.0			False
IJHS-52-2017-Issue-2	Historical Note:Cause of Sunrise, Sunset from Jnanesvari and its comparison to Aryabhatiya 	 Anand Dabak	https://insa.nic.in/(S(eh1ucortlbqqezipwgliy3mn))/writereaddata/UpLoadedFiles/IJHS/Vol52_2_2017__Art07.pdf	344.0			False
IJHS-52-2017-Issue-2	Historical Note: Allusions of Rasayanasastra in Telugu Literature 	 Iragavarapu Suryanarayana	https://insa.nic.in/(S(eh1ucortlbqqezipwgliy3mn))/writereaddata/UpLoadedFiles/IJHS/Vol52_2_2017__Art08.pdf	542.0			False
IJHS-52-2017-Issue-2	Historical Note: General Scientific Societies in British India 	 B K Sen	https://insa.nic.in/(S(eh1ucortlbqqezipwgliy3mn))/writereaddata/UpLoadedFiles/IJHS/Vol52_2_2017__Art09.pdf	467.0			False
IJHS-52-2017-Issue-2	Historical Note: Syamadas Mukhopadhyay (1866-1937): A Reputed Geometrician of India 	 Purabi Mukherji and Mala Bhattacharjee	https://insa.nic.in/(S(eh1ucortlbqqezipwgliy3mn))/writereaddata/UpLoadedFiles/IJHS/Vol52_2_2017__Art10.pdf	289.0			False
IJHS-52-2017-Issue-2	Book Review: Gauhar Raza, R Gopichandran, Gurdeep S Sappal and TV Venkateswaran (editors) : Moments of Eureka- Life & Works of Selected Indian Scientists 	 Kankan Bhattacharyya	https://insa.nic.in/(S(eh1ucortlbqqezipwgliy3mn))/writereaddata/UpLoadedFiles/IJHS/Vol52_2_2017__Art12.pdf	158.0			False
IJHS-52-2017-Issue-2	Book Review: B S Shylaja and V S S Sastry : Jantar Mantar Observatories of Jai Singh 	 S Balachandra Rao	https://insa.nic.in/(S(eh1ucortlbqqezipwgliy3mn))/writereaddata/UpLoadedFiles/IJHS/Vol52_2_2017__Art13.pdf	236.0			False
IJHS-52-2017-Issue-2	Project Report: History of High Tin Bronze and Brass of Eastern India 	 Pranab K Chattopadhayay	https://insa.nic.in/(S(eh1ucortlbqqezipwgliy3mn))/writereaddata/UpLoadedFiles/IJHS/Vol52_2_2017__Art11.pdf	1004.0			False
IJHS-52-2017-Issue-3	Identification of Mosquitoes, Nature of Diseases and Treatment in Early Sanskrit Literature 	 Sagan Deep Kaur and Lakhvir Singh	https://insa.nic.in/(S(eh1ucortlbqqezipwgliy3mn))/writereaddata/UpLoadedFiles/IJHS/Vol52_3_2017__Art01.pdf	926.0			False
IJHS-52-2017-Issue-3	Importance of Plants as depicted in Puranas 	 Dhananjay Vasudeo Dwivedi	https://insa.nic.in/(S(eh1ucortlbqqezipwgliy3mn))/writereaddata/UpLoadedFiles/IJHS/Vol52_3_2017__Art02.pdf	277.0			False
IJHS-52-2017-Issue-3	Strivilasa – An Ayurvedic Manuscript on Cosmetic Procedures of Females, Aphrodisiacs, Diseases and M 	 Goli Penchala Prasad et al.	https://insa.nic.in/(S(eh1ucortlbqqezipwgliy3mn))/writereaddata/UpLoadedFiles/IJHS/Vol52_3_2017__Art03.pdf	324.0			False
IJHS-52-2017-Issue-3	Western Medicine in French Pondichery (1690–1954) 	 Ramya Raman and Anantanarayanan Raman	https://insa.nic.in/(S(eh1ucortlbqqezipwgliy3mn))/writereaddata/UpLoadedFiles/IJHS/Vol52_3_2017__Art04.pdf	1809.0			False
IJHS-52-2017-Issue-3	Institutionalization of Nursing as Profession in the Early Twentieth Century Bengal 	 Sneha Sanyal	https://insa.nic.in/(S(eh1ucortlbqqezipwgliy3mn))/writereaddata/UpLoadedFiles/IJHS/Vol52_3_2017__Art05.pdf	411.0			False
IJHS-52-2017-Issue-3	Historical Notes: The Jaina School of Indian Mathematics 	 Dipak Jadhav	https://insa.nic.in/(S(eh1ucortlbqqezipwgliy3mn))/writereaddata/UpLoadedFiles/IJHS/Vol52_3_2017__Art06.pdf	343.0			False
IJHS-52-2017-Issue-3	Historical Notes: Mango in Ancient Indian Sculptures and during Akbar Period 	 N C Shah	https://insa.nic.in/(S(eh1ucortlbqqezipwgliy3mn))/writereaddata/UpLoadedFiles/IJHS/Vol52_3_2017__Art07.pdf	430.0			False
IJHS-52-2017-Issue-3	Historical Note: Why and When were the Vijayanagara Walls Built? ..... 	 Jean Deloche	https://insa.nic.in/(S(eh1ucortlbqqezipwgliy3mn))/writereaddata/UpLoadedFiles/IJHS/Vol52_3_2017__Art08.pdf	114.0			False
IJHS-52-2017-Issue-3	Historical Note: B B Ray and Controversy over the Spectral Raman-lines 	 Rajinder Singh	https://insa.nic.in/(S(eh1ucortlbqqezipwgliy3mn))/writereaddata/UpLoadedFiles/IJHS/Vol52_3_2017__Art09.pdf	1202.0			False
IJHS-52-2017-Issue-3	Book Review: Scientifically Yours 	 Kankan Bhattacharyya	https://insa.nic.in/(S(eh1ucortlbqqezipwgliy3mn))/writereaddata/UpLoadedFiles/IJHS/Vol52_3_2017__Art10.pdf	93.0			False
IJHS-52-2017-Issue-3	Book Review: Tracks of Change: Railways and Everyday Life in Colonial India 	 Debashis Mandal	https://insa.nic.in/(S(eh1ucortlbqqezipwgliy3mn))/writereaddata/UpLoadedFiles/IJHS/Vol52_3_2017__Art11.pdf	126.0			False
IJHS-52-2017-Issue-3	Project Report: History of Science Museums and Planetariums in India 	 Jayanta Sthanapati	https://insa.nic.in/(S(eh1ucortlbqqezipwgliy3mn))/writereaddata/UpLoadedFiles/IJHS/Vol52_3_2017__Art12.pdf	1410.0			False
IJHS-52-2017-Issue-4	Contents 	 Contents	https://insa.nic.in/(S(eh1ucortlbqqezipwgliy3mn))/writereaddata/UpLoadedFiles/IJHS/Contents.pdf	100.0			False
IJHS-52-2017-Issue-4	Date of Mahābhārata War Based on Astronomical References—A Reassessment 	 Ashok K Bhatnagar	https://insa.nic.in/(S(eh1ucortlbqqezipwgliy3mn))/writereaddata/UpLoadedFiles/IJHS/Vol52_4_2017__Art01.pdf	1063.0			False
IJHS-52-2017-Issue-4	Aryabhata-II and his Concept of Concave Quadrilateral 	 Amalkumar Mukhopadhyay	https://insa.nic.in/(S(eh1ucortlbqqezipwgliy3mn))/writereaddata/UpLoadedFiles/IJHS/Vol52_4_2017__Art02.pdf	449.0			False
IJHS-52-2017-Issue-4	Sisir Kumar Mitra, Scientific Achievements and the Fellowship of the Royal Society of London 	 Rajinder Singh	https://insa.nic.in/(S(eh1ucortlbqqezipwgliy3mn))/writereaddata/UpLoadedFiles/IJHS/Vol52_4_2017__Art03.pdf	1227.0			False
IJHS-52-2017-Issue-4	History of the Scientific Study of the Tibeto-Burman Languages of North-East India 	 Satarupa Dattamajumdar	https://insa.nic.in/(S(eh1ucortlbqqezipwgliy3mn))/writereaddata/UpLoadedFiles/IJHS/Vol52_4_2017__Art04.pdf	1921.0			False
IJHS-52-2017-Issue-4	Historical Notes: Some Thoughts on Hindu Medicine —An Address by Kaviraj Mahamahopadhyaya Gananath.. 	 N C Shah	https://insa.nic.in/(S(eh1ucortlbqqezipwgliy3mn))/writereaddata/UpLoadedFiles/IJHS/Vol52_4_2017__Art05.pdf	974.0			False
IJHS-52-2017-Issue-4	Historical Notes: Science Education and Science Writing in Hindi in the North West Provinces... 	 Pooja Mishra	https://insa.nic.in/(S(eh1ucortlbqqezipwgliy3mn))/writereaddata/UpLoadedFiles/IJHS/Vol52_4_2017__Art06.pdf	376.0			False
IJHS-52-2017-Issue-4	Book Review: Bengal Water Craft: Boat-Building and Fishing Communities by Lotika Varadarajan 	 Smritikumar Sarkar	https://insa.nic.in/(S(eh1ucortlbqqezipwgliy3mn))/writereaddata/UpLoadedFiles/IJHS/Vol52_4_2017__Art07.pdf	165.0			False
IJHS-52-2017-Issue-4	Book Review: India’s Nobel Prize: Nominators and Nominees, by Rajinder Singh 	 Kankan Bhattacharyya	https://insa.nic.in/(S(eh1ucortlbqqezipwgliy3mn))/writereaddata/UpLoadedFiles/IJHS/Vol52_4_2017__Art08.pdf	83.0			False
IJHS-52-2017-Issue-4	Book Review: Inside Story of Nobel Peace Prize: Indian Contestants by Rajinder Singh 	 Kankan Bhattacharyya	https://insa.nic.in/(S(eh1ucortlbqqezipwgliy3mn))/writereaddata/UpLoadedFiles/IJHS/Vol52_4_2017__Art09.pdf	90.0			False
IJHS-52-2017-Issue-4	Project Report: History of Technology Adoption and Development: The Case of Silk Industry.... 	 Anirban Mukherjee	https://insa.nic.in/(S(eh1ucortlbqqezipwgliy3mn))/writereaddata/UpLoadedFiles/IJHS/Vol52_4_2017__Art10.pdf	120.0			False
IJHS-52-2017-Issue-4	Obituary: Lotika Varadarajan (1934-2017) 	 Surajit Sarkar	https://insa.nic.in/(S(eh1ucortlbqqezipwgliy3mn))/writereaddata/UpLoadedFiles/IJHS/Vol52_4_2017__Art11.pdf	171.0			False
IJHS-52-2017-Issue-4	News: The 25th International Congress of History of Science and Technology... 	 Gulfishan Khan	https://insa.nic.in/(S(eh1ucortlbqqezipwgliy3mn))/writereaddata/UpLoadedFiles/IJHS/Vol52_4_2017__Art12.pdf	128.0			False
IJHS-52-2017-Issue-4	Books Received (2017) 	 Madhvendra Narayan	https://insa.nic.in/(S(eh1ucortlbqqezipwgliy3mn))/writereaddata/UpLoadedFiles/IJHS/13-Books%20Received%20for%20Review.pdf	126.0			False
IJHS-52-2017-Issue-4	Ganitapancavimsi — Sanskrit Text with Introduction, English Translation and Notes 	 K S Shukla	https://insa.nic.in/(S(eh1ucortlbqqezipwgliy3mn))/writereaddata/UpLoadedFiles/IJHS/Vol52_4_2017__Art13.pdf	2318.0			False
IJHS-52-2017-Issue-4	Cumulative Index 	 Madhvendra Narayan	https://insa.nic.in/(S(eh1ucortlbqqezipwgliy3mn))/writereaddata/UpLoadedFiles/IJHS/17-Cumulativeindex.pdf	135.0			False
IJHS-52-2017-Issue-4	Annual Contents 	 Madhvendra Narayan	https://insa.nic.in/(S(eh1ucortlbqqezipwgliy3mn))/writereaddata/UpLoadedFiles/IJHS/18-Contentsall.pdf	114.0			False
IJHS-53-2018-Issue-1	Contents 	 Contents	https://insa.nic.in/(S(eh1ucortlbqqezipwgliy3mn))/writereaddata/UpLoadedFiles/IJHS/Vol53_1_2018__Contents.pdf	89.0			False
IJHS-53-2018-Issue-1	Madhava’s Multi-pronged Approach for Obtaining the Praṇakalantara 	 Aditya Kolachana, K Mahesh and K Ramasubramanian	https://insa.nic.in/(S(eh1ucortlbqqezipwgliy3mn))/writereaddata/UpLoadedFiles/IJHS/Vol53_1_2018__Art01.pdf	244.0			False
IJHS-53-2018-Issue-1	Ahargana in Makarandasarini and Other Indian Astronomical Texts 	 S K Uma and S Balachandra Rao	https://insa.nic.in/(S(eh1ucortlbqqezipwgliy3mn))/writereaddata/UpLoadedFiles/IJHS/Vol53_1_2018__Art02.pdf	429.0			False
IJHS-53-2018-Issue-1	Medical Education on the Colonial Periphery: A Study of Medical Institutions in Patna and Dacca 	 Aishwaryarupa Majumdar	https://insa.nic.in/(S(eh1ucortlbqqezipwgliy3mn))/writereaddata/UpLoadedFiles/IJHS/Vol53_1_2018__Art03.pdf	286.0			False
IJHS-53-2018-Issue-1	Celebrating the 90th Anniversary of the Raman Effect 	 Rajinder Singh	https://insa.nic.in/(S(eh1ucortlbqqezipwgliy3mn))/writereaddata/UpLoadedFiles/IJHS/Vol53_1_2018__Art04.pdf	777.0			False
IJHS-53-2018-Issue-1	Indian Arthropods in Early Sanskrit Literature: A Taxonomical Analysis 	 Sagan Deep Kaur and Lakhvir Singh	https://insa.nic.in/(S(eh1ucortlbqqezipwgliy3mn))/writereaddata/UpLoadedFiles/IJHS/Vol53_1_2018__Art05.pdf	154.0			False
IJHS-53-2018-Issue-1	A Small History of Bedbugs in India 	 Shubhneet Kaushik	https://insa.nic.in/(S(eh1ucortlbqqezipwgliy3mn))/writereaddata/UpLoadedFiles/IJHS/Vol53_1_2018__Art06.pdf	155.0			False
IJHS-53-2018-Issue-1	History of Development of Homoeopathy in India 	 Ajoy Kumar Ghosh	https://insa.nic.in/(S(eh1ucortlbqqezipwgliy3mn))/writereaddata/UpLoadedFiles/IJHS/Vol53_1_2018__Art07.pdf	138.0			False
IJHS-53-2018-Issue-1	First Fifty Years (1900-1950) of Physiology in India 	 Amar K Chandra	https://insa.nic.in/(S(eh1ucortlbqqezipwgliy3mn))/writereaddata/UpLoadedFiles/IJHS/Vol53_1_2018__Art08.pdf	194.0			False
IJHS-53-2018-Issue-1	Correspondence: Date of Mahabharata War Based on Astronomical References: A K Bhatnagar 	 B N Narahari Achar	https://insa.nic.in/(S(eh1ucortlbqqezipwgliy3mn))/writereaddata/UpLoadedFiles/IJHS/Vol53_1_2018__Art09.pdf	169.0			False
IJHS-53-2018-Issue-1	Book Review: Ayurvedic Inheritance — A Reader’s Companion by M S Valiathan 	 Anantanarayanan Raman	https://insa.nic.in/(S(eh1ucortlbqqezipwgliy3mn))/writereaddata/UpLoadedFiles/IJHS/Vol53_1_2018__Art10.pdf	156.0			False
IJHS-53-2018-Issue-1	Book Review: Technology of the Tribes of Northeast India by Amrendra Kumar Thakur 	 J N Sinha	https://insa.nic.in/(S(eh1ucortlbqqezipwgliy3mn))/writereaddata/UpLoadedFiles/IJHS/Vol53_1_2018__Art11.pdf	111.0			False
IJHS-53-2018-Issue-1	Project Report: Medicine and British Empire in South India: A Study of Psychiatry and Mental Asylums 	 Santhosh Abraham	https://insa.nic.in/(S(eh1ucortlbqqezipwgliy3mn))/writereaddata/UpLoadedFiles/IJHS/Vol53_1_2018__Art12.pdf	124.0			False
IJHS-53-2018-Issue-2	Contents 	 IJHS	https://insa.nic.in/(S(eh1ucortlbqqezipwgliy3mn))/writereaddata/UpLoadedFiles/IJHS/Vol53_2_2018__Contents.pdf	87.0			False
IJHS-53-2018-Issue-2	Concept of Sruti, Svara and Raga of Classical Music in Sanskrit Texts 	 RN Iyengar	https://insa.nic.in/(S(eh1ucortlbqqezipwgliy3mn))/writereaddata/UpLoadedFiles/IJHS/Vol53_2_2018__Art01.pdf	567.0		https://cahc.jainuniversity.ac.in/assets/cached_papers/rni/Vol53_2_2018__Art01.pdf	True
IJHS-53-2018-Issue-2	Brass, Zinc and the Beginning of Chemical Industry 	 Paul T Craddock	https://insa.nic.in/(S(eh1ucortlbqqezipwgliy3mn))/writereaddata/UpLoadedFiles/IJHS/Vol53_2_2018__Art02.pdf	2752.0			False
IJHS-53-2018-Issue-2	Indigenous and Western Medicines in Colonial South India: Nature of Discourses and Impact  	 D V Kanagarathinam 	https://insa.nic.in/(S(eh1ucortlbqqezipwgliy3mn))/writereaddata/UpLoadedFiles/IJHS/Vol53_2_2018__Art03.pdf	206.0			False
IJHS-53-2018-Issue-2	Punjab Agricultural College and Research Institute, Lyallpur (1906-1947): Generating Knowledge for.. 	 Kamlesh Mohan	https://insa.nic.in/(S(eh1ucortlbqqezipwgliy3mn))/writereaddata/UpLoadedFiles/IJHS/Vol53_2_2018__Art04.pdf	297.0			False
IJHS-53-2018-Issue-2	Historical Note: History of  Yavaka from Ethno-pharmacological Perspective 	 Rajeshwari Singh, Mita Kotecha and N Srikant	https://insa.nic.in/(S(eh1ucortlbqqezipwgliy3mn))/writereaddata/UpLoadedFiles/IJHS/Vol53_2_2018__Art05.pdf	327.0			False
IJHS-53-2018-Issue-2	Historical Note: The Incredible Survival of Stone Wheel Manufacture in South India 	 Jean Deloche	https://insa.nic.in/(S(eh1ucortlbqqezipwgliy3mn))/writereaddata/UpLoadedFiles/IJHS/Vol53_2_2018__Art06.pdf	7085.0			False
IJHS-53-2018-Issue-2	Correspondence: A Physics Museum in BHU in 1942  	 B Anantha Dasannacharya	https://insa.nic.in/(S(eh1ucortlbqqezipwgliy3mn))/writereaddata/UpLoadedFiles/IJHS/Vol53_2_2018__Art07.pdf	2266.0			False
IJHS-53-2018-Issue-2	Book Reviews: Vedic Mathematics mattu Vedagalalli Vijnana by S Balachandra Rao 	 B S Shylaja	https://insa.nic.in/(S(eh1ucortlbqqezipwgliy3mn))/writereaddata/UpLoadedFiles/IJHS/Vol53_2_2018__Art08.pdf	118.0			False
IJHS-53-2018-Issue-2	Book Reviews: Plants of Kedarnath Wildlife Sanctuary, Western Himalaya: A Field Guide by ... 	 N C Shah	https://insa.nic.in/(S(eh1ucortlbqqezipwgliy3mn))/writereaddata/UpLoadedFiles/IJHS/Vol53_2_2018__Art09.pdf	119.0			False
IJHS-53-2018-Issue-2	Book Reviews: A Brief History of Science by  Breakthrough Science Society, Kolkata 	 Kankan Bhattacharyya	https://insa.nic.in/(S(eh1ucortlbqqezipwgliy3mn))/writereaddata/UpLoadedFiles/IJHS/Vol53_2_2018__Art10.pdf	106.0			False
IJHS-53-2018-Issue-2	News: Workshop on Importance of Eclipses in the History of Astronomy 	 BS Shylaja	https://insa.nic.in/(S(eh1ucortlbqqezipwgliy3mn))/writereaddata/UpLoadedFiles/IJHS/Vol53_2_2018__Art11.pdf	95.0			False
IJHS-53-2018-Issue-3	Harappan Shell Industry: An Overview 	 V H Sonawane	https://insa.nic.in/(S(eh1ucortlbqqezipwgliy3mn))/writereaddata/UpLoadedFiles/IJHS/Vol53_3_2018__Art01.pdf	1524.0			False
IJHS-53-2018-Issue-3	Indus Ceramic Industries: Complexities, Challenges and Prospects 	 K Krishnan	https://insa.nic.in/(S(eh1ucortlbqqezipwgliy3mn))/writereaddata/UpLoadedFiles/IJHS/Vol53_3_2018__Art02.pdf	195.0			False
IJHS-53-2018-Issue-3	Copper Vessels in the Indus Valley Civilization: A Case Study in the Light of Harinagar Hoard 	 Bhuvan Vikrama and Arakhita Pradhan	https://insa.nic.in/(S(eh1ucortlbqqezipwgliy3mn))/writereaddata/UpLoadedFiles/IJHS/Vol53_3_2018__Art03.pdf	377.0			False
IJHS-53-2018-Issue-3	Metals and Metallurgy in the Harappan Civilization 	 Vibha Tripathi	https://insa.nic.in/(S(eh1ucortlbqqezipwgliy3mn))/writereaddata/UpLoadedFiles/IJHS/Vol53_3_2018__Art04.pdf	998.0			False
IJHS-53-2018-Issue-3	Indigo — The Crop that Created History and then Itself Became History 	 Rajendra Prasad	https://insa.nic.in/(S(eh1ucortlbqqezipwgliy3mn))/writereaddata/UpLoadedFiles/IJHS/Vol53_3_2018__Art05.pdf	142.0			False
IJHS-53-2018-Issue-3	Determination of Ascensional Difference in the Lagnaprakarana 	 Aditya Kolachana et al.	https://insa.nic.in/(S(eh1ucortlbqqezipwgliy3mn))/writereaddata/UpLoadedFiles/IJHS/Vol53_3_2018__Art06.pdf	191.0			False
IJHS-53-2018-Issue-3	Historical Note: The Origin of the 28 Naksatras in Early Indian Astronomy and Astrology 	 Howard D Jones	https://insa.nic.in/(S(eh1ucortlbqqezipwgliy3mn))/writereaddata/UpLoadedFiles/IJHS/Vol53_3_2018__Art07.pdf	159.0			False
IJHS-53-2018-Issue-3	Historical Note:Reactions of Emperor Bahadur Shah Zafar and Laureate Mirza Ghalib to the Celestial.. 	 R C Kapoor	https://insa.nic.in/(S(eh1ucortlbqqezipwgliy3mn))/writereaddata/UpLoadedFiles/IJHS/Vol53_3_2018__Art08.pdf	360.0			False
IJHS-53-2018-Issue-3	Historical Note: Philippe Barbier and His Knowledge of Plants and Inorganic Principles in the... 	 Jaime Wisniak	https://insa.nic.in/(S(eh1ucortlbqqezipwgliy3mn))/writereaddata/UpLoadedFiles/IJHS/Vol53_3_2018__Art09.pdf	283.0			False
IJHS-53-2018-Issue-3	Historical Note: Bibha Chowdhuri – Her Cosmic Ray Studies in Manchester 	 S C Roy and Rajinder Singh	https://insa.nic.in/(S(eh1ucortlbqqezipwgliy3mn))/writereaddata/UpLoadedFiles/IJHS/Vol53_3_2018__Art10.pdf	1916.0			False
IJHS-53-2018-Issue-3	Book Review: The Continuation of Ancient Mathematics: Wang Xiatong’s Jigu suanjing, Algebra and... 	 R C Gupta	https://insa.nic.in/(S(eh1ucortlbqqezipwgliy3mn))/writereaddata/UpLoadedFiles/IJHS/Vol53_3_2018__Art11.pdf	346.0			False
IJHS-53-2018-Issue-3	Book Review: CV Raman’s Laboratory and Discovery of the Raman Effect 	 Kankan Bhattacharyya	https://insa.nic.in/(S(eh1ucortlbqqezipwgliy3mn))/writereaddata/UpLoadedFiles/IJHS/Vol53_3_2018__Art12.pdf	93.0			False
IJHS-53-2018-Issue-3	Project Report: The State of Ayurveda in Colonial Bengal 	 Srabani Sen	https://insa.nic.in/(S(eh1ucortlbqqezipwgliy3mn))/writereaddata/UpLoadedFiles/IJHS/Vol53_3_2018__Art13.pdf	126.0			False
IJHS-53-2018-Issue-4	Contents 	 IJHS	https://insa.nic.in/(S(eh1ucortlbqqezipwgliy3mn))/writereaddata/UpLoadedFiles/IJHS/Vol53_4_2018__Contents.pdf	376.0			False
IJHS-53-2018-Issue-4	Editorial: Indo-European Encounter and Features of Modern Science in Pre-Colonial & Colonial India 	 AK Bag	https://insa.nic.in/(S(eh1ucortlbqqezipwgliy3mn))/writereaddata/UpLoadedFiles/IJHS/Vol53_4_2018__Art01.pdf	348.0			False
IJHS-53-2018-Issue-4	Guest Editorial: Emergence of Modern Science in Colonial India 	 Arnab Rai Choudhuri and Deepak Kumar	https://insa.nic.in/(S(eh1ucortlbqqezipwgliy3mn))/writereaddata/UpLoadedFiles/IJHS/Vol53_4_2018__Art02.pdf	94.0			False
IJHS-53-2018-Issue-4	Science Institutions in Colonial India: Some Snippets, Some Lessons 	 Deepak Kumar	https://insa.nic.in/(S(eh1ucortlbqqezipwgliy3mn))/writereaddata/UpLoadedFiles/IJHS/Vol53_4_2018__Art03.pdf	137.0			False
IJHS-53-2018-Issue-4	Indo-Persian and Urdu Speaking Elites’ Discourses on the Modern European Science 	 Gulfishan Khan	https://insa.nic.in/(S(eh1ucortlbqqezipwgliy3mn))/writereaddata/UpLoadedFiles/IJHS/Vol53_4_2018__Art04.pdf	375.0			False
IJHS-53-2018-Issue-4	Two Early Pillars of Modern Scientific Education in India: The Meaning and Relevance of the... 	 John Lourdusamy	https://insa.nic.in/(S(eh1ucortlbqqezipwgliy3mn))/writereaddata/UpLoadedFiles/IJHS/Vol53_4_2018__Art05.pdf	124.0			False
IJHS-53-2018-Issue-4	Curzon’s Role in the Development of Technical and University Education in India 	 Sujata Banerjee and Sunayana Maiti	https://insa.nic.in/(S(eh1ucortlbqqezipwgliy3mn))/writereaddata/UpLoadedFiles/IJHS/Vol53_4_2018__Art06.pdf	118.0			False
IJHS-53-2018-Issue-4	Shanti Swarup Bhatnagar, Working through/against the Colonial System 	 Robert Anderson	https://insa.nic.in/(S(eh1ucortlbqqezipwgliy3mn))/writereaddata/UpLoadedFiles/IJHS/Vol53_4_2018__Art07.pdf	804.0			False
IJHS-53-2018-Issue-4	Judging Scientific Creativity: The Case of the Early Jagadis Bose 	 Subrata Dasgupta	https://insa.nic.in/(S(eh1ucortlbqqezipwgliy3mn))/writereaddata/UpLoadedFiles/IJHS/Vol53_4_2018__Art08.pdf	151.0			False
IJHS-53-2018-Issue-4	How Costly was Raman’s Equipment for the Discovery of Raman Effect? 	 Rajinder Singh	https://insa.nic.in/(S(eh1ucortlbqqezipwgliy3mn))/writereaddata/UpLoadedFiles/IJHS/Vol53_4_2018__Art09.pdf	644.0			False
IJHS-53-2018-Issue-4	K S Krishnan as Co-discoverer of Raman Effect and as Independent Scientist 	 DCV Mallik	https://insa.nic.in/(S(eh1ucortlbqqezipwgliy3mn))/writereaddata/UpLoadedFiles/IJHS/Vol53_4_2018__Art10.pdf	124.0			False
IJHS-53-2018-Issue-4	From Atoms to Stars: Meghnad Saha (1893-1956) 	 Atri Mukhopadhyay	https://insa.nic.in/(S(eh1ucortlbqqezipwgliy3mn))/writereaddata/UpLoadedFiles/IJHS/Vol53_4_2018__Art11.pdf	128.0			False
IJHS-53-2018-Issue-4	Going Beyond the Big Three of Calcutta Physicists: B B Ray, D M Bose and S K Mitra 	 Rajinder Singh	https://insa.nic.in/(S(eh1ucortlbqqezipwgliy3mn))/writereaddata/UpLoadedFiles/IJHS/Vol53_4_2018__Art12.pdf	1118.0			False
IJHS-53-2018-Issue-4	Reflecting on Chemical Education: Nilratan Dhar and the Legacy of P C Ray 	 Madhumita Mazumdar	https://insa.nic.in/(S(eh1ucortlbqqezipwgliy3mn))/writereaddata/UpLoadedFiles/IJHS/Vol53_4_2018__Art13.pdf	129.0			False
IJHS-53-2018-Issue-4	Shaping the Chemical Industry and Saving the Cotton Industry: Role of Sir P C Ray, a Visionary 	 Syamal Chakrabarti	https://insa.nic.in/(S(eh1ucortlbqqezipwgliy3mn))/writereaddata/UpLoadedFiles/IJHS/Vol53_4_2018__Art14.pdf	1350.0			False
IJHS-53-2018-Issue-4	Organic Chemists of Pre-Independence India: With Special Focus on Natural Products 	 D Balasubramanian	https://insa.nic.in/(S(eh1ucortlbqqezipwgliy3mn))/writereaddata/UpLoadedFiles/IJHS/Vol53_4_2018__Art15.pdf	247.0			False
IJHS-53-2018-Issue-4	Ronald Ross to U N Brahmachari: Medical Research in Colonial India 	 John Mathew	https://insa.nic.in/(S(eh1ucortlbqqezipwgliy3mn))/writereaddata/UpLoadedFiles/IJHS/Vol53_4_2018__Art16.pdf	234.0			False
IJHS-53-2018-Issue-4	History of X-ray Research in Colonial India 	 SC Roy	https://insa.nic.in/(S(eh1ucortlbqqezipwgliy3mn))/writereaddata/UpLoadedFiles/IJHS/Vol53_4_2018__Art17.pdf	854.0			False
IJHS-53-2018-Issue-4	Colonial Encounter on Indian Snakes and their Venoms: The Transmission and Transformation... 	 Rahul Bhaumik	https://insa.nic.in/(S(eh1ucortlbqqezipwgliy3mn))/writereaddata/UpLoadedFiles/IJHS/Vol53_4_2018__Art18.pdf	138.0			False
IJHS-53-2018-Issue-4	Butto Krishna Paul & Co – An Enterprise for Localization of Foreign Medicines in Colonial Calcutta 	 Malika Basu	https://insa.nic.in/(S(eh1ucortlbqqezipwgliy3mn))/writereaddata/UpLoadedFiles/IJHS/Vol53_4_2018__Art19.pdf	446.0			False
IJHS-53-2018-Issue-4	Institutionalization of Leprosy Researches in Calcutta School of Tropical Medicine (CSTM) and... 	 Apalak Das	https://insa.nic.in/(S(eh1ucortlbqqezipwgliy3mn))/writereaddata/UpLoadedFiles/IJHS/Vol53_4_2018__Art20.pdf	126.0			False
IJHS-53-2018-Issue-4	Institutionalizing of Veterinary Science in Colonial India 	 Maidul Rahaman	https://insa.nic.in/(S(eh1ucortlbqqezipwgliy3mn))/writereaddata/UpLoadedFiles/IJHS/Vol53_4_2018__Art21.pdf	324.0			False
IJHS-53-2018-Issue-4	Birbal Sahni and His Father Ruchi Ram: Science in Punjab Emerging from the Shadows of the Raj 	 Ashok Sahni	https://insa.nic.in/(S(eh1ucortlbqqezipwgliy3mn))/writereaddata/UpLoadedFiles/IJHS/Vol53_4_2018__Art22.pdf	397.0			False
IJHS-53-2018-Issue-4	Transnational History of Imperial Council of Agricultural Research, 1929–1947 	 Vinod Kumar Singh	https://insa.nic.in/(S(eh1ucortlbqqezipwgliy3mn))/writereaddata/UpLoadedFiles/IJHS/Vol53_4_2018__Art23.pdf	130.0			False
IJHS-53-2018-Issue-4	Environmental Science in India during First half of 20th Century 	 Baisakhi Bandyopadhyay	https://insa.nic.in/(S(eh1ucortlbqqezipwgliy3mn))/writereaddata/UpLoadedFiles/IJHS/Vol53_4_2018__Art24.pdf	121.0			False
IJHS-53-2018-Issue-4	The Beginnings of Modern Astronomy Research in British India: Pogson and Evershed 	 Biman B Nath	https://insa.nic.in/(S(eh1ucortlbqqezipwgliy3mn))/writereaddata/UpLoadedFiles/IJHS/Vol53_4_2018__Art25.pdf	246.0			False
IJHS-53-2018-Issue-4	The Forgotten Indian Pioneers of Fingerprint Science: Fallout of Colonialism 	 G S Sodhi and Jasjeet Kaur	https://insa.nic.in/(S(eh1ucortlbqqezipwgliy3mn))/writereaddata/UpLoadedFiles/IJHS/Vol53_4_2018__Art26.pdf	616.0			False
IJHS-53-2018-Issue-4	Prasanta Chandra Mahalanobis and the Beginning of the Indian Statistical Institute 	 Samir Kumar Saha	https://insa.nic.in/(S(eh1ucortlbqqezipwgliy3mn))/writereaddata/UpLoadedFiles/IJHS/Vol53_4_2018__Art27.pdf	1115.0			False
